{
  "version": "1.0.0",
  "schemaVersion": "1.0.0",
  "project": "LLMGateway",

  "terms": [
    {
      "term": "Backend",
      "definition": "A configured LLM service endpoint the gateway can route queries to. May be local (running on the same machine) or cloud (remote API).",
      "examples": ["llama.cpp server on localhost:8080", "Anthropic API"],
      "relatedTerms": ["Backend Pool", "Local Backend", "Cloud Backend"],
      "category": "domain"
    },
    {
      "term": "Backend Pool",
      "definition": "The registry of all configured backends and their current availability state maintained at runtime.",
      "relatedTerms": ["Backend"],
      "category": "domain"
    },
    {
      "term": "Query",
      "definition": "A single request from a developer submitted to the gateway for routing and processing by a backend.",
      "examples": ["A code completion request", "A natural language question"],
      "relatedTerms": ["Route Decision", "Log Entry"],
      "category": "domain"
    },
    {
      "term": "Route Decision",
      "definition": "The output of the routing step: which backend was selected for a given query and the reason for selection.",
      "relatedTerms": ["Query", "Router", "Classifier"],
      "category": "domain"
    },
    {
      "term": "Classifier",
      "definition": "The component that analyses a query and assigns it a complexity tier to inform routing.",
      "relatedTerms": ["Router", "Query"],
      "category": "domain"
    },
    {
      "term": "Router",
      "definition": "The component that selects a backend for a query based on its complexity tier, configured priority, and backend availability.",
      "relatedTerms": ["Classifier", "Backend Pool", "Route Decision"],
      "category": "domain"
    },
    {
      "term": "Complexity Tier",
      "definition": "A categorical label assigned to a query by the Classifier indicating how capable a backend needs to be to handle it. Examples: simple, moderate, complex.",
      "examples": ["simple", "moderate", "complex"],
      "relatedTerms": ["Classifier"],
      "category": "domain"
    },
    {
      "term": "Fallback",
      "definition": "The automatic selection of the next available backend when the preferred backend is unavailable or returns an error.",
      "relatedTerms": ["Backend Pool", "Router"],
      "category": "domain"
    },
    {
      "term": "Log Entry",
      "definition": "A persisted record of a single processed query including the backend used, routing decision, response latency, and outcome.",
      "relatedTerms": ["Query", "Route Decision"],
      "category": "domain"
    },
    {
      "term": "Routing Overhead",
      "definition": "The latency added by the gateway's classification and routing logic on top of the backend's own response time.",
      "relatedTerms": ["Classifier", "Router"],
      "category": "technical"
    },
    {
      "term": "Local Backend",
      "definition": "A backend running as a process on the same machine as the gateway, accessed via localhost.",
      "examples": ["llama.cpp", "LM Studio", "Ollama"],
      "synonyms": ["local model"],
      "relatedTerms": ["Backend", "Cloud Backend"],
      "category": "domain"
    },
    {
      "term": "Cloud Backend",
      "definition": "A backend accessed via a remote HTTP API, typically requiring an API key for authentication.",
      "examples": ["Anthropic API", "OpenRouter"],
      "synonyms": ["cloud model", "remote backend"],
      "relatedTerms": ["Backend", "Local Backend"],
      "category": "domain"
    },
    {
      "term": "OpenAI-compatible",
      "definition": "Conforming to the request and response format of the OpenAI Chat Completions API, allowing clients built for OpenAI to work without modification.",
      "relatedTerms": ["Backend", "Query"],
      "category": "technical"
    },
    {
      "term": "Priority Order",
      "definition": "The user-configured ranked list of backends the Router consults in sequence when selecting a backend for a query.",
      "relatedTerms": ["Router", "Backend Pool"],
      "category": "domain"
    },
    {
      "term": "Override",
      "definition": "An explicit instruction from the developer to route a query to a specific backend, bypassing classification and priority logic.",
      "relatedTerms": ["Router", "Route Decision"],
      "category": "domain"
    }
  ]
}
